{
  "lieferung_id": "del-aurelia-2026-06-07-002",
  "schema_version": "3.4",
  "projekt_kurzname": "aurelia",
  "konzept_ref": {
    "konzept_id": "8a3d2f1c-5b7e-4a89-9c3d-2f1c5b7e4a89",
    "schema_version": "1.0",
    "prozessprofil_ref": "11111111-2222-3333-4444-555555555555",
    "kp_id": "KP-07",
    "source_file": "bc2-material/mock/mock_automatisierungskonzept.json"
  },
  "erzeugt_am": "2026-06-07T23:00:00+02:00",
  "generator": {
    "modell": "manuell-v3.4-mock",
    "lauf_id": "manuell-2026-06-07-aurelia-ep1",
    "regelbasiert": true
  },
  "menschliche_pruefung_noetig": true,
  "epics": [
    {
      "epic_id": "aurelia-EP1",
      "use_case_id_ref": "uc-1111-1111-1111-111111111111",
      "titel": "Automatisierte Antragserfassung via OCR + LLM-Extraktion",
      "ziel": "Eingehende Antraege aus Mail, Portal und Scanner werden binnen 30 Sekunden in SAP angelegt; bei niedriger Konfidenz wandert der Antrag in eine HitL-Queue fuer die Sachbearbeitung. Erfassungszeit sinkt von 5 Min auf < 1 Min, ROI 80%.",
      "kategorien": ["it:backend", "it:integration", "it:ai-pipeline"],
      "stories": [
        {
          "story_id": "aurelia-EP1.1",
          "titel": "Antragseingang aus 3 Kanaelen einlesen + Duplikat-Pruefung",
          "typ": "user_story",
          "beschreibung": "Als Sachbearbeiterin moechte ich, dass eingehende Antraege aus Mail-Postfach, Online-Portal und Dokumentenscanner automatisch erfasst und auf Duplikate geprueft werden, damit kein Antrag verloren geht und keine Doppelbearbeitung passiert.",
          "akzeptanzkriterien": [
            {
              "text": "Bei Mail-Eingang im Postfach wird Antrag binnen 60 s in die Eingangs-Queue aufgenommen",
              "messverfahren": "IMAP-Poll-Integrationstest; Queue-Eintrag mit Source-Hash verifizieren"
            },
            {
              "text": "Bei Doppel-Eingang (gleiche Versicherten-ID + Zeitraum innerhalb 7 Tagen) wird Antrag mit Status 'Duplikat-Warnung' versehen und an Sachbearbeitung geroutet",
              "messverfahren": "Test mit zwei identischen Mail-Eingaengen; SAP-Status 'Duplikat-Warnung' pruefen"
            }
          ],
          "kategorien": ["it:integration", "it:backend"],
          "abhaengigkeiten": []
        },
        {
          "story_id": "aurelia-EP1.2",
          "titel": "OCR + LLM-Extraktion von 12 Pflichtfeldern mit Konfidenz-Score",
          "typ": "user_story",
          "beschreibung": "Als Sachbearbeiterin moechte ich, dass aus dem Antrag automatisch alle 12 Pflichtfelder (Versicherten-ID, Name, Geburtsdatum, Antragsart, Zeitraum von/bis, AU-Datum, Arzt, Bankverbindung, Antragsdatum, Unterschrift-Flag, Anlagen, Sonderbemerkungen) extrahiert werden, damit ich nicht mehr abtippen muss.",
          "akzeptanzkriterien": [
            {
              "text": "Fuer jedes der 12 Pflichtfelder liefert die Pipeline einen Wert und einen Konfidenz-Score zwischen 0 und 1",
              "messverfahren": "Test-Set mit 100 Antraegen, Konfidenz pro Feld geloggt, manuelle Stichprobe 10%"
            },
            {
              "text": "Antwortzeit pro Antrag von Eingang bis SAP-Anlage ist < 30 s im Median",
              "messverfahren": "Lastmessung 300 Antraege, p50 < 30 s, p95 < 60 s"
            }
          ],
          "kategorien": ["it:backend", "it:ai-pipeline"],
          "abhaengigkeiten": ["aurelia-EP1.1"]
        },
        {
          "story_id": "aurelia-EP1.3",
          "titel": "SAP-Anlage + DMS-Ablage + Eingangsbestaetigung",
          "typ": "user_story",
          "beschreibung": "Als Versicherter moechte ich, dass mein Antrag automatisch in SAP angelegt wird und ich binnen Sekunden eine Eingangsbestaetigung mit Antragsnummer erhalte, damit ich den Status sehen kann.",
          "akzeptanzkriterien": [
            {
              "text": "Antrag mit allen Pflichtfeldern wird per SAP-REST-API als Datensatz angelegt; PDF-Original wandert ins SAP-DMS",
              "messverfahren": "SAP-Query nach Antragsnummer liefert vollstaendigen Datensatz + verknuepften DMS-Eintrag"
            },
            {
              "text": "Eingangsbestaetigung mit Antragsnummer wird via Portal/Mail an Versicherten zugestellt binnen 60 s nach SAP-Anlage",
              "messverfahren": "End-to-End-Test, Mail-Eingang bzw. Portal-Notification gemessen"
            }
          ],
          "kategorien": ["it:integration", "it:backend"],
          "abhaengigkeiten": ["aurelia-EP1.2"]
        },
        {
          "story_id": "aurelia-EP1.C1",
          "titel": "HitL-Pruefschritt bei Konfidenz < 0,8 auf einem Pflichtfeld",
          "typ": "task",
          "beschreibung": "Als Sachbearbeiterin moechte ich, dass Antraege mit unsicherer Extraktion (Konfidenz < 0,8 auf einem Pflichtfeld) in eine eigene Pruef-Queue wandern, damit ich nur die unklaren Faelle bearbeiten muss und Felder bereits vorbelegt sind. Diese Story entsteht aus der Compliance-Vorpruefung (siehe compliance-audit.json, pflicht_id p1).",
          "akzeptanzkriterien": [
            {
              "text": "Antrag mit min. einem Pflichtfeld < 0,8 Konfidenz erscheint binnen 5 s in der HitL-Queue mit vorbelegten Feldern und Markierung des unsicheren Feldes",
              "messverfahren": "Test mit praeparierten Antraegen (handschriftliche Anmerkungen); Queue-Eintrag mit Highlight pruefen"
            },
            {
              "text": "Sachbearbeitung bestaetigt binnen 24 h; bei Nicht-Bearbeitung Eskalation an Teamleitung",
              "messverfahren": "Eskalations-Logik mit simulierter 24-h-Wartezeit testen"
            }
          ],
          "kategorien": ["it:frontend", "gov:hitl"],
          "abhaengigkeiten": ["aurelia-EP1.2"]
        }
      ]
    }
  ],
  "gate2": {
    "status": "pending"
  }
}
